儿媳妻子母娘的巨乳对我是无限的色情欲望,/xiazai/9715.html
催眠被私通的爆奶他人之妻強行被中出,/xiazai/9714.html
人妻按摩棒放置變得想要純粹做愛監測,/xiazai/9711.html
人妻們的羞恥泡泡浴研修,/xiazai/9706.html
人妻浮気心,/xiazai/9705.html
亲密感觉野宫里美,/xiazai/9704.html
満足新妻,/xiazai/9702.html
乳首,/xiazai/9700.html
久違的肉棒幹得爽的不停的超敏感人妻,/xiazai/9698.html
中出近親相姦母子恥辱交尾小林里穂,/xiazai/9695.html
中出大姑的誘惑艷麗黑皮膚的嫂嫂,/xiazai/9693.html
中出大哥的女儿千秋,/xiazai/9691.html
东京都住宅人妻搭讪做爱生中出,/xiazai/9689.html
专属女优水谷心音卒業記念粉丝感谢祭,/xiazai/9688.html
丈夫眼前成為鄰居勞工的活塞俘虜不貞妻子,/xiazai/9686.html
丈夫所不知的人妻願望,/xiazai/9684.html
丈夫不倫賠償被侵犯的不正常的人妻,/xiazai/9681.html
親友被侵犯,/xiazai/9678.html
不倫彼女,/xiazai/9675.html
オ会NTR,/xiazai/9674.html
