巨乳兄嫁中出相姦,/xiazai/32882.html
我的女孩,/xiazai/32881.html
來去溫泉幹砲吧,/xiazai/32758.html
媽媽朋友們溫泉旅行聯合起來玩弄,/xiazai/32757.html
媽媽的巨乳是我的,/xiazai/32756.html
美麗的妻子結交了好朋友,/xiazai/32617.html
美麗的大乳房妻子,/xiazai/32616.html
美味的精液暨燕子挤压石原三木,/xiazai/32615.html
美素人樣子的風俗店面試,/xiazai/32614.html
能無套插入無套內射,/xiazai/32514.html
乃亞的痴女全套服務,/xiazai/32513.html
啦啦隊女郎,/xiazai/32396.html
第一次生日體驗,/xiazai/32395.html
我阿姨的身體太舒服了,/xiazai/32394.html
母乳喂養,/xiazai/32293.html
從高中時代開始到畢業後,/xiazai/32292.html
只是扭曲它你無法阻止它,/xiazai/32291.html
性肌肉備用籃球苗條漂亮的女孩,/xiazai/32290.html
超級偶像4小時,/xiazai/32177.html
剃光私人剃光女僕Azumaki,/xiazai/32176.html
