蹲伏的cunnry MANIAX,/xiazai/32612.html
能插翻櫻由羅的奢侈無套泡泡浴,/xiazai/32552.html
名作官能小説が実写化,/xiazai/32551.html
敏感的身體會因抽筋而悶悶不樂,/xiazai/32550.html
傷後立即穿刺恢復超級驚厥,/xiazai/32393.html
當地電視台的女孩,/xiazai/32392.html
這才是真正的興奮點,/xiazai/32391.html
讓你的妹妹假裝在時間停下來,/xiazai/32294.html
青奸4P乱交卒業旅行,/xiazai/32175.html
從第一次亮相中退出,/xiazai/32069.html
一個愛上栗子的女人,/xiazai/31943.html
熱門流行系列,/xiazai/31827.html
我還在忙著和一匹小馬訂婚,/xiazai/31692.html
重複暨通過滴下乳狀汁的女性兄弟會,/xiazai/31691.html
一朵白花34歲的AV登場,/xiazai/31690.html
八字奶爆乳剧烈地摇晃,/xiazai/31566.html
爆乳痴女毫无忌惮做爱,/xiazai/31565.html
爆乳百華治癒淫語與快樂淫語,/xiazai/31564.html
一個不起眼的G杯,/xiazai/31451.html
爆乳人妻性奴调教映像,/xiazai/31450.html
