状態絶頂,/xiazai/34275.html
你的身體是犯罪,/xiazai/34274.html
尋求不間斷的超級鋼棒,/xiazai/34273.html
魔鏡問題暑假很快,/xiazai/34024.html
和兄弟的電動阿瑪失禁,/xiazai/34023.html
白虎大亂交解禁激活塞,/xiazai/34022.html
被女友的妹妹愛過頭,/xiazai/33921.html
被沉迷痴漢色狼侵犯的,/xiazai/33920.html
在男朋友面前被抓住了,/xiazai/33919.html
本設施附有隨時插入專門做愛的溫泉旅館,/xiazai/33790.html
被虐的家庭教師,/xiazai/33789.html
癡女用巨乳如玩具一般玩弄男人,/xiazai/33788.html
超喜歡肉棒精液的吸舔女高中生,/xiazai/33692.html
不停插入上下的嘴引導大量射精的PTM性交,/xiazai/33691.html
從早幹爆內射到晚,/xiazai/33690.html
從順洩慾女經理,/xiazai/33599.html
到了摄影棚之后马上就遭到袭击,/xiazai/33598.html
在大停電的那個晚上,/xiazai/33597.html
大量顔射淋精覚醒4性交,/xiazai/33476.html
對母性飢餓的童貞兒子責任的巨乳母親,/xiazai/33475.html
