欠幹的混混義妹看我沒女人緣而素股,/xiazai/36157.html
前所未有的大量潮吹,/xiazai/36156.html
全勃肉棒肏翻爆射,/xiazai/36011.html
悄悄的做愛,/xiazai/36010.html
強壓中出榨精到天亮,/xiazai/36009.html
人妻性奴隸美乳覺醒,/xiazai/35885.html
丈夫性交回來滿足慾望,/xiazai/35884.html
確實迷倒處男的慾求不滿人妻的日常,/xiazai/35736.html
肉体接待を強要された巨乳若女将,/xiazai/35735.html
曬黑gals新人,/xiazai/35608.html
無法停止的嫉妬,/xiazai/35607.html
我是最愛大叔的受虐狂,/xiazai/35467.html
喂她喝下春藥之後理性完全喪失的爆乳美女,/xiazai/35466.html
現役女大生也讓人射進去啦,/xiazai/35465.html
無套中出猛幹喝下媚藥肉感巨乳妹,/xiazai/35464.html
性愛練習教練 倉多真緒,/xiazai/35341.html
小惡魔禁忌愛愛姐妹丼,/xiazai/35340.html
性感帶被開發了,/xiazai/35339.html
性愛天才正妹過激痙攣高潮193次,/xiazai/35338.html
即使射精不能讓Chipo難以置信,/xiazai/35200.html
