清纯翘乳美女密室連続絶頂乱交,/xiazai/28710.html
清纯美少女家政性处理服务,/xiazai/28579.html
全身性感帯人妻濃厚性戯,/xiazai/28578.html
全裸幫忙家事服務,/xiazai/28577.html
檢查你的胯部並抓住它,/xiazai/28468.html
懷孕的每月禁慾生活,/xiazai/28467.html
幸運的色情突然襲擊在日常生活中,/xiazai/28343.html
柔肌色香溢出日服少女高级援交侍奉,/xiazai/28342.html
美麗的女孩,/xiazai/28341.html
美巨乳痴女比基尼着衣満載登场,/xiazai/28247.html
原始生產新聞節目,/xiazai/28246.html
神秘的現役人妻痙攣絕頂暴風雨追擊性交,/xiazai/28112.html
社長爆乳日記,/xiazai/28111.html
濕透攝影精油按摩的師徒關係,/xiazai/28110.html
我會把它給出來,/xiazai/28002.html
穿著制服貼在裸露的皮膚上,/xiazai/28001.html
我只有大山雀總是看色情線,/xiazai/28000.html
精湛的授權,/xiazai/27890.html
天使美少女無邪気な接吻乱交,/xiazai/27889.html
体育会系美少女AV出道,/xiazai/27888.html
