本能裸露真中出解禁,/xiazai/37303.html
爆乳医生和护士,/xiazai/37302.html
美丽的女人充满爱汁和厚厚的性感,/xiazai/37301.html
爱抚大师全员集合,/xiazai/37300.html
毛茸茸的童颜爆乳,/xiazai/37299.html
在魔术镜航班的外景拍摄中相遇,/xiazai/37126.html
金枪鱼Bussan,/xiazai/37125.html
体会到那样的你,/xiazai/37124.html
虽然很傻但是受精还是很厉害的,/xiazai/36980.html
大奶美女.,/xiazai/36979.html
坂道,/xiazai/36978.html
难以穿透的防弹女演员,/xiazai/36977.html
世界上最可爱的18岁,/xiazai/36641.html
女教師校内凌辱,/xiazai/36508.html
我討厭的慾望和秘密,/xiazai/36507.html
天生的育种精子成妹妹的未成熟射液,/xiazai/36506.html
你可以記住,/xiazai/36411.html
一個突然推著新娘的姐姐,/xiazai/36410.html
女友的大姐姐偷偷淫誘惑我,/xiazai/36409.html
女高中生中出性交課外授業,/xiazai/36284.html
